title,url,source,published_date,category,content
Hello World,https://example.com,Example,2025-10-01 10:00 UTC,Technology,"The rapid evolution of technology continues to redefine how societies function. From artificial intelligence to quantum computing, breakthroughs in research are accelerating innovation at an unprecedented rate. Businesses are increasingly turning to automation and data analytics to streamline operations, while consumers experience a seamless digital transformation through connected devices and cloud-based services. Experts believe that the next decade will be marked by even greater convergence between biology, computing, and sustainability efforts."
Second Row,https://example.org,ExampleOrg,2025-10-02 12:00 UTC,Science,"A group of international scientists has unveiled a revolutionary approach to renewable energy production using organic materials. Their study highlights how bio-engineered algae could replace traditional fossil fuels by capturing carbon dioxide and converting it into usable fuel. The project’s success could dramatically reduce greenhouse gas emissions and shift global dependence toward cleaner alternatives. Environmental organizations have praised the findings, calling it a significant step toward a carbon-neutral future."
Morning Health Routine,https://news.example.net,DailyNews,2025-10-05 09:30 UTC,Health,"New research published by the Global Wellness Institute suggests that morning exercise routines have profound effects on mental health and productivity. Participants who engaged in at least 20 minutes of moderate physical activity reported lower stress levels, better focus, and improved emotional stability. Psychologists emphasize the importance of consistency, noting that even short daily habits can reshape the brain’s stress-response system. Employers are now exploring workplace wellness programs that encourage such behaviors."
The Future of AI,https://tech.example.io,TechInsights,2025-10-10 14:00 UTC,Technology,"Artificial intelligence has moved from research labs into nearly every aspect of daily life, driving applications in education, medicine, finance, and public safety. However, as the capabilities of AI systems expand, so do concerns over ethical deployment and job displacement. Industry leaders advocate for transparency and global cooperation to ensure that innovation benefits society as a whole. The next wave of AI development will likely focus on explainability and sustainable computing infrastructure."
Exploring the Cosmos,https://science.example.org,ScienceDaily,2025-11-02 12:00 UTC,Science,"A recent space mission led by an international coalition of researchers has provided the most detailed images of Jupiter’s atmosphere to date. Using high-resolution sensors, scientists were able to map storm systems and analyze chemical compositions that shed light on planetary formation. The data also suggests that Jupiter’s magnetic field interacts with its moons in previously unknown ways, offering clues about habitability conditions on icy celestial bodies. The findings mark a milestone in our ongoing quest"
The Future of AI,https://tech.example.io,TechInsights,2025-10-10 14:00 UTC,Technology,"Artificial intelligence has moved from research labs into nearly every aspect of daily life, driving applications in education, medicine, finance, and public safety. However, as the capabilities of AI systems expand, so do concerns over ethical deployment and job displacement. Industry leaders advocate for transparency and global cooperation to ensure that innovation benefits society as a whole. The next wave of AI development will likely focus on explainability and sustainable computing infrastructure."
The Future of AI,https://tech.example.io,TechInsights,2025-10-10 14:00 UTC,Technology,"Artificial intelligence has moved from research labs into nearly every aspect of daily life, driving applications in education, medicine, finance, and public safety. However, as the capabilities of AI systems expand, so do concerns over ethical deployment and job displacement. Industry leaders advocate for transparency and global cooperation to ensure that innovation benefits society as a whole. The next wave of AI development will likely focus on explainability and sustainable computing infrastructure."

